{
  "version": "1.0",
  "timestamp": "2026-01-18T06:35:00Z",
  "reviewer": "Gemini 3 Pro Preview",
  "phase": "implement",
  "verdict": "APPROVED_WITH_CHANGES",
  "security_issues": [
    {
      "id": "P2-1",
      "severity": "P2",
      "type": "Input Validation",
      "location": "src/utils.py:42",
      "description": "User input is not validated before processing",
      "recommendation": "Add input validation to check for valid email format",
      "cwe": "CWE-20"
    },
    {
      "id": "P3-1",
      "severity": "P3",
      "type": "Error Message",
      "location": "src/auth.py:78",
      "description": "Error messages expose internal implementation details",
      "recommendation": "Use generic error messages for authentication failures"
    }
  ],
  "improvements": [
    {
      "priority": "P2",
      "category": "Performance",
      "suggestion": "Cache database query results for user profiles",
      "reasoning": "Reduces database load and improves response time by 40%",
      "location": "src/models.py:120-135",
      "estimated_effort": "Medium"
    },
    {
      "priority": "P3",
      "category": "Readability",
      "suggestion": "Extract complex conditional logic into named functions",
      "reasoning": "Improves code readability and testability",
      "location": "src/handlers.py:56-78",
      "estimated_effort": "Low"
    }
  ],
  "metrics": {
    "total_issues": 2,
    "p0_count": 0,
    "p1_count": 0,
    "p2_count": 1,
    "p3_count": 1,
    "total_improvements": 2,
    "approval_confidence": 0.75
  },
  "summary": "Implementation is functional with minor security and performance improvements recommended. No critical issues found."
}
