{
  "version": "1.0",
  "timestamp": "2026-01-18T06:30:00Z",
  "reviewer": "Gemini 3 Pro Preview",
  "phase": "design",
  "verdict": "APPROVED",
  "security_issues": [],
  "improvements": [
    {
      "priority": "P3",
      "category": "Documentation",
      "suggestion": "Add more detailed comments to complex functions",
      "reasoning": "Improves maintainability for future developers"
    }
  ],
  "metrics": {
    "total_issues": 0,
    "p0_count": 0,
    "p1_count": 0,
    "p2_count": 0,
    "p3_count": 0,
    "total_improvements": 1,
    "approval_confidence": 0.95
  },
  "summary": "Design is well-structured and follows best practices. No security issues found."
}
